{"$defs":{"CriterionResult":{"additionalProperties":false,"description":"One gate criterion's outcome (§13.3).","properties":{"evidence":{"items":{"pattern":"^[0-9a-f]{64}$","type":"string"},"title":"Evidence","type":"array"},"expected":{"$ref":"#/$defs/JsonValue"},"id":{"title":"Id","type":"string"},"observed":{"$ref":"#/$defs/JsonValue"},"result":{"enum":["pass","fail"],"title":"Result","type":"string"},"statement":{"title":"Statement","type":"string"}},"required":["id","statement","result","observed","expected","evidence"],"title":"CriterionResult","type":"object"},"JsonValue":{},"NegativeControl":{"additionalProperties":false,"description":"One negative control's outcome (§13.3).","properties":{"criterion_id":{"title":"Criterion Id","type":"string"},"expected_fail":{"items":{"type":"string"},"title":"Expected Fail","type":"array"},"observed_failing_criteria":{"items":{"type":"string"},"title":"Observed Failing Criteria","type":"array"},"result":{"enum":["pass","fail"],"title":"Result","type":"string"},"sabotage":{"title":"Sabotage","type":"string"}},"required":["criterion_id","sabotage","expected_fail","observed_failing_criteria","result"],"title":"NegativeControl","type":"object"}},"$id":"https://agenttruth.dev/schemas/gate-report.v1.json","$schema":"https://json-schema.org/draft/2020-12/schema","additionalProperties":false,"description":"``evidence/K<n>/gate-K<n>.json``, written only by ``agenttruth gate K<n>``.","properties":{"contract_version":{"title":"Contract Version","type":"string"},"criteria":{"items":{"$ref":"#/$defs/CriterionResult"},"title":"Criteria","type":"array"},"environment":{"additionalProperties":{"type":"string"},"title":"Environment","type":"object"},"gate":{"title":"Gate","type":"string"},"git_dirty":{"title":"Git Dirty","type":"boolean"},"git_sha":{"title":"Git Sha","type":"string"},"inputs":{"additionalProperties":{"type":"string"},"title":"Inputs","type":"object"},"negative_controls":{"items":{"$ref":"#/$defs/NegativeControl"},"title":"Negative Controls","type":"array"},"schema":{"const":"agenttruth.gate-report/v1","title":"Schema","type":"string"},"verdict":{"enum":["pass","fail"],"title":"Verdict","type":"string"}},"required":["schema","gate","contract_version","git_sha","git_dirty","environment","inputs","criteria","negative_controls","verdict"],"title":"GateReport","type":"object"}
