{"contract_version":"1.0.1","criteria":[{"evidence":["0cbebd37f857b99c2e2a9e447c5930d8a01d30513f3ef63f0bda5e57e208a2f8","6dc8bae99f02918ac37fbe2eb75439652194e5e46ff5718dcd2df4cb30b6a6fd","7b6d770329e3a36d86952441abe107550cda1d3f1e641fd682a8b1857487a50e","a1bbd1a8600c490a61a6ad2d2d8b7b42b8691af847cba43a8f6e0bab7537e480"],"expected":{"identical_builds_equal_to_lock":{"ds0":{"events.jsonl":"28a649786b258926409f8f5ea8f56d81522df6925b6c216686862f38f9ee55e7","ledger.json":"e09834099cf220d3fb7744db366c0bd65be0717704cf60c86c618ea194f7f236","manifest.json":"6dc8bae99f02918ac37fbe2eb75439652194e5e46ff5718dcd2df4cb30b6a6fd"},"ds1":{"events.jsonl":"a33149eb4e79788b7384ae51b4643406270dd3bf9ca2d8027bd17bb8eb3ad7d6","ledger.json":"8e15c7c11381a29bf62a0436bd563c34c3b92ecb18be47c549e09e25366424cd","manifest.json":"7b6d770329e3a36d86952441abe107550cda1d3f1e641fd682a8b1857487a50e"}}},"id":"K1-C1","observed":{"ds0":{"build_a_hashseed_1":{"events.jsonl":"28a649786b258926409f8f5ea8f56d81522df6925b6c216686862f38f9ee55e7","ledger.json":"e09834099cf220d3fb7744db366c0bd65be0717704cf60c86c618ea194f7f236","manifest.json":"6dc8bae99f02918ac37fbe2eb75439652194e5e46ff5718dcd2df4cb30b6a6fd"},"build_b_hashseed_2":{"events.jsonl":"28a649786b258926409f8f5ea8f56d81522df6925b6c216686862f38f9ee55e7","ledger.json":"e09834099cf220d3fb7744db366c0bd65be0717704cf60c86c618ea194f7f236","manifest.json":"6dc8bae99f02918ac37fbe2eb75439652194e5e46ff5718dcd2df4cb30b6a6fd"},"manifest_consistent":true},"ds1":{"build_a_hashseed_1":{"events.jsonl":"a33149eb4e79788b7384ae51b4643406270dd3bf9ca2d8027bd17bb8eb3ad7d6","ledger.json":"8e15c7c11381a29bf62a0436bd563c34c3b92ecb18be47c549e09e25366424cd","manifest.json":"7b6d770329e3a36d86952441abe107550cda1d3f1e641fd682a8b1857487a50e"},"build_b_hashseed_2":{"events.jsonl":"a33149eb4e79788b7384ae51b4643406270dd3bf9ca2d8027bd17bb8eb3ad7d6","ledger.json":"8e15c7c11381a29bf62a0436bd563c34c3b92ecb18be47c549e09e25366424cd","manifest.json":"7b6d770329e3a36d86952441abe107550cda1d3f1e641fd682a8b1857487a50e"},"manifest_consistent":true}},"result":"pass","statement":"ds0 and ds1 built twice in two fresh processes into two empty directories yield identical events.jsonl, ledger.json, manifest.json SHA-256, equal to datasets/*.lock.json."},{"evidence":["666717b6d286d59b2943063ef129cca4b2dd01de97d610190c054bbee2ab3354","d7eca2f7f4b1bc8ffd5b286f59fc74ecb056ec8b05d716c2e7a693c37651f6e6"],"expected":{"committed_truths_reproduced":true,"different":[],"truths_sha256":"666717b6d286d59b2943063ef129cca4b2dd01de97d610190c054bbee2ab3354"},"id":"K1-C2","observed":{"committed_truths_reproduced":true,"different":[],"equal":21,"scenarios":21,"truths_sha256":"666717b6d286d59b2943063ef129cca4b2dd01de97d610190c054bbee2ab3354"},"result":"pass","statement":"For every EA/PC scenario, ledger value == oracle value (exact for counts/mappings/rankings; amounts in integer cents); the committed truths file is the oracle's output."},{"evidence":["17197f4f7f85d4c157fb9b0c59f0a2d9c28e4f5c02b9c07653b2324714094470"],"expected":{"min_signatures":3,"problems":[]},"id":"K1-C3","observed":{"ea_scenarios":16,"problems":[],"signatures":73},"result":"pass","statement":"For every EA scenario, truth and declared signature values are pairwise distinguishable under §9.2 tolerance; every EA scenario declares >= 3 signatures."},{"evidence":["9e607bb014dc60650543b960767495d923ea57c431862cbfbffa79cd6a378ac0"],"expected":{"problems":[]},"id":"K1-C4","observed":{"faults":{"F1":{"diff_days":["2026-07-15","2026-07-16","2026-07-17"],"diff_events":64,"ea_changed":["ea-funnel-activation-july","ea-uploads-by-os-july","ea-uploads-july-filtered"],"ea_declared":["ea-funnel-activation-july","ea-uploads-by-os-july","ea-uploads-july-filtered"],"probe_changes":{"uploads-by-os-daily":["2026-07-15|Android","2026-07-16|Android","2026-07-17|Android"]}},"F2":{"diff_days":["2026-08-03","2026-08-04","2026-08-05","2026-08-06","2026-08-07","2026-08-08","2026-08-09"],"diff_events":69,"ea_changed":[],"ea_declared":[],"probe_changes":{"shares-by-browser-daily":["2026-08-03|Firefox","2026-08-04|Firefox","2026-08-05|Firefox","2026-08-06|Firefox","2026-08-07|Firefox","2026-08-08|Firefox","2026-08-09|Firefox"]}},"F3":{"diff_days":["2026-06-22","2026-06-23","2026-06-24","2026-06-25","2026-06-26","2026-06-27","2026-06-28"],"diff_events":35,"ea_changed":["ea-funnel-signup-upload-1d","ea-funnel-signup-upload-june","ea-sql-power-uploaders"],"ea_declared":["ea-funnel-signup-upload-1d","ea-funnel-signup-upload-june","ea-sql-power-uploaders"],"probe_changes":{"pageview-persons-daily":["2026-06-22","2026-06-23","2026-06-24","2026-06-25","2026-06-26","2026-06-27","2026-06-28"],"signup-upload-14d":["converted"]}},"F4":{"diff_days":["2026-07-27","2026-07-28","2026-07-29"],"diff_events":3683,"ea_changed":[],"ea_declared":[],"probe_changes":{"pageviews-daily":["2026-07-27","2026-07-28","2026-07-29"]}},"F5":{"diff_days":["2026-08-17","2026-08-18","2026-08-19","2026-08-20","2026-08-23","2026-08-25","2026-08-26","2026-08-27","2026-08-28","2026-08-29","2026-08-30","2026-08-31"],"diff_events":31,"ea_changed":[],"ea_declared":[],"probe_changes":{"upgrades-by-plan-daily":["2026-08-17|personal/pro","2026-08-17|pro","2026-08-18|personal/pro","2026-08-18|pro","2026-08-19|personal/pro","2026-08-19|pro","2026-08-20|personal/pro","2026-08-20|pro","2026-08-23|personal/pro","2026-08-23|pro","2026-08-25|personal/pro","2026-08-25|pro","2026-08-26|personal/pro","2026-08-26|pro","2026-08-27|personal/pro","2026-08-27|pro","2026-08-28|personal/pro","2026-08-28|pro","2026-08-29|personal/pro","2026-08-29|pro","2026-08-30|personal/pro","2026-08-30|pro","2026-08-31|personal/pro","2026-08-31|pro"]}}},"problems":[]},"result":"pass","statement":"Every EA scenario declares the planted faults its truth overlaps. For each F1-F5, rebuilding with that fault disabled changes events only inside the fault's declared window and segment (§5.2), including its first and last day; changes every probe metric of the fault's PC scenario; and changes exactly the EA truths declared as overlapping that fault."},{"evidence":["14f5f60c3ad18d8c0d610858a920e950f0264ad3e027156782adae552ac0917c"],"expected":{"problems":[]},"id":"K1-C5","observed":{"mutations":[{"description":"remove uploaded_file ds1-u00051-0006 (plain-uploader)","id":"M1","kind":"drop_in_range_uploaded_file","match":true,"observed":{"ea-uploads-by-os-july":{"Android":435,"Linux":314,"Mac OS X":1509,"Windows":1720,"iOS":434},"ea-uploads-july-filtered":3303},"predicted":{"ea-uploads-by-os-july":{"Android":435,"Linux":314,"Mac OS X":1509,"Windows":1720,"iOS":434},"ea-uploads-july-filtered":3303}},{"description":"move signed_up ds1-u00005-0001 by 1 ms across local midnight","id":"M2","kind":"move_boundary_event_across_local_midnight","match":true,"observed":{"ea-signups-day-0714":31},"predicted":{"ea-signups-day-0714":31}},{"description":"change the email of internal user int-m3-target to int-m3-target@example.com","id":"M3","kind":"change_internal_user_email_domain","match":true,"observed":{"ea-active-week-0706":352,"ea-uploads-july-filtered":3306},"predicted":{"ea-active-week-0706":352,"ea-uploads-july-filtered":3306}},{"description":"duplicate signed_up ds1-u00008-0001 as ds1-u00008-0001-m4dup","id":"M4","kind":"duplicate_signed_up","match":true,"observed":{"ea-signups-day-0714":33},"predicted":{"ea-signups-day-0714":33}},{"description":"remove $identify ds1-u00052-0002 (power-june)","id":"M5","kind":"remove_identify","match":true,"observed":{"ea-funnel-signup-upload-1d":{"converted":248,"entered":655},"ea-funnel-signup-upload-june":{"converted":378,"entered":655},"ea-sql-power-uploaders":101},"predicted":{"ea-funnel-signup-upload-1d":{"converted":248,"entered":655},"ea-funnel-signup-upload-june":{"converted":378,"entered":655},"ea-sql-power-uploaders":101}}],"problems":[]},"result":"pass","statement":"Each event-file mutation (drop one in-range uploaded_file; move one boundary event by 1 ms across local midnight; change one internal user's email domain; duplicate one signed_up; remove one $identify) changes exactly the predicted scenario truths by the predicted delta."},{"evidence":["6b436670c84c40c60ab64bb5a7f8241a637fa6dbc45c3af9a3a227ec30cc9825","bbed1a29308ab82c49cb41a621492140dc0acf48d1a2d831d9bdb13177e16264","e637dde704c4ef0cde59fed05a2a52874cf6cc4cb2f16dd8c5838ee754e413cc"],"expected":{"lint_ok":true,"rs_defaults_current":true,"schema_ts_validation":{"ok":true,"tasks":27}},"id":"K1-C6","observed":{"by_kind":{"exact_answer":16,"planted_cause":5,"roundtrip_agent":6,"roundtrip_scripted":27},"export_exit":0,"lint_exit":0,"lint_issues":[],"lint_ok":true,"rs_defaults_current":true,"scenarios":54,"schema_ts_validation":{"ok":true,"tasks":27,"version":2}},"result":"pass","statement":"scenarios lint passes (ids unique, kebab-case, categories valid, every SEM/SIG id exists, RS values differ from defaults); export validates against the vendored PostHog schema.ts."},{"evidence":["7f503cd15e9b378ac15f98e97dcdf150f3f1f98263d10a76960f0ff073d3cf2d"],"expected":{"mypy_strict":0,"pytest":0,"pytest_summary":{"errors":0,"failures":0,"skipped":0,"socket_guard_passed":true},"ruff_check":0,"ruff_format":0},"id":"K1-C7","observed":{"mypy_strict":0,"pytest":0,"pytest_summary":{"errors":0,"failures":0,"skipped":0,"socket_guard_passed":true,"tests":57},"ruff_check":0,"ruff_format":0},"result":"pass","statement":"ruff check, ruff format --check, mypy --strict on src/, pytest -q all pass; no network used by offline tests."},{"evidence":["8bff680049c33fcbeda26ce04c0e6e0fe2b54317c225eeb9521126a43dc758e4"],"expected":{"gate_ast_violations":[],"pytest_import_rules":0},"id":"K1-C8","observed":{"gate_ast_violations":[],"modules":34,"pytest_import_rules":0},"result":"pass","statement":"AST test proves the §4.1 import rules."}],"environment":{"node":"v24.21.0","platform":"Linux x86_64","python":"3.14.6","uv":"uv 0.12.24 (x86_64-unknown-linux-gnu)"},"gate":"K1","git_dirty":false,"git_sha":"c40702b07f980430bd34a7d533f6d0d5d0541856","inputs":{